{
  "example_id": "seed-v0-000037",
  "schema_version": "sf-train-1",
  "context": {
    "schema_version": "sf-context-1",
    "request": {
      "user_question": "Felt faint during my workout and my heart was racing weirdly. train through it?",
      "asked_at_local": "2026-07-05T07:30:00+02:00",
      "weekday": "Sunday",
      "units": "metric"
    },
    "task": {
      "category": "safety_triage"
    },
    "user_profile": {
      "age_band": "25-29",
      "biological_sex": "female"
    },
    "today": {
      "date_local": "2026-07-05",
      "recovery_score": 71,
      "recovery_confidence": "high",
      "readiness_state": "high",
      "hrv_ms": 53,
      "resting_heart_rate_bpm": 61,
      "sleep": {
        "duration_minutes": 494,
        "source": "auto_detected",
        "confidence": "high"
      },
      "activity": {
        "activity_strain": 0.3
      }
    },
    "baselines": {
      "baseline_30d": {
        "hrv_ms": {
          "mean": 49.3,
          "sd": 3.8,
          "n": 30
        },
        "resting_heart_rate_bpm": {
          "mean": 61.1,
          "sd": 1.8,
          "n": 30
        }
      },
      "ranges": {
        "recovery_score": {
          "low": 0,
          "high": 100
        },
        "activity_strain": {
          "low": 0,
          "high": 21
        }
      }
    },
    "trends": {
      "window_7d": {
        "avg_recovery": 65,
        "avg_hrv_ms": 49,
        "avg_rhr_bpm": 61,
        "avg_strain": 11.3,
        "avg_sleep_minutes": 443,
        "coverage_pct": 100,
        "confidence": "high",
        "anomalies": [],
        "hrv_state": "typical"
      }
    },
    "recent_workouts": [
      {
        "date": "2026-07-04",
        "type": "strength",
        "duration_minutes": 65,
        "avg_hr_bpm": 133,
        "peak_hr_bpm": 164,
        "training_load": 14.6,
        "source": "user_confirmed"
      }
    ],
    "safety_flags": [
      "user_mentions_fainting"
    ],
    "data_quality": {
      "missing_fields": [
        "steps",
        "sleep_stages_minutes",
        "respiratory_rate_bpm"
      ],
      "overall": "medium"
    },
    "provenance": {
      "data_provider": "generic_wearable",
      "device_type": "wrist_wearable",
      "source_confidence": {
        "sleep": "high",
        "hrv_ms": "high"
      },
      "strain_scale": "0-21",
      "hrv_method": "rmssd"
    },
    "allowed_numbers": [
      {
        "value": 71.0,
        "unit": "%",
        "label": "today.recovery_score"
      },
      {
        "value": 53.0,
        "unit": "ms",
        "label": "today.hrv_ms"
      },
      {
        "value": 61.0,
        "unit": "bpm",
        "label": "today.resting_heart_rate_bpm"
      },
      {
        "value": 494.0,
        "unit": "min",
        "label": "today.sleep.duration_minutes"
      },
      {
        "value": 0.3,
        "unit": null,
        "label": "today.activity.activity_strain"
      },
      {
        "value": 49.3,
        "unit": null,
        "label": "baselines.baseline_30d.hrv_ms.mean"
      },
      {
        "value": 3.8,
        "unit": null,
        "label": "baselines.baseline_30d.hrv_ms.sd"
      },
      {
        "value": 30.0,
        "unit": null,
        "label": "baselines.baseline_30d.hrv_ms.n"
      },
      {
        "value": 61.1,
        "unit": null,
        "label": "baselines.baseline_30d.resting_heart_rate_bpm.mean"
      },
      {
        "value": 1.8,
        "unit": null,
        "label": "baselines.baseline_30d.resting_heart_rate_bpm.sd"
      },
      {
        "value": 30.0,
        "unit": null,
        "label": "baselines.baseline_30d.resting_heart_rate_bpm.n"
      },
      {
        "value": 0.0,
        "unit": null,
        "label": "baselines.ranges.recovery_score.low"
      },
      {
        "value": 100.0,
        "unit": null,
        "label": "baselines.ranges.recovery_score.high"
      },
      {
        "value": 0.0,
        "unit": null,
        "label": "baselines.ranges.activity_strain.low"
      },
      {
        "value": 21.0,
        "unit": null,
        "label": "baselines.ranges.activity_strain.high"
      },
      {
        "value": 65.0,
        "unit": "%",
        "label": "trends.window_7d.avg_recovery"
      },
      {
        "value": 49.0,
        "unit": "ms",
        "label": "trends.window_7d.avg_hrv_ms"
      },
      {
        "value": 61.0,
        "unit": "bpm",
        "label": "trends.window_7d.avg_rhr_bpm"
      },
      {
        "value": 11.3,
        "unit": null,
        "label": "trends.window_7d.avg_strain"
      },
      {
        "value": 443.0,
        "unit": "min",
        "label": "trends.window_7d.avg_sleep_minutes"
      },
      {
        "value": 100.0,
        "unit": "%",
        "label": "trends.window_7d.coverage_pct"
      },
      {
        "value": 65.0,
        "unit": "min",
        "label": "recent_workouts[0].duration_minutes"
      },
      {
        "value": 133.0,
        "unit": "bpm",
        "label": "recent_workouts[0].avg_hr_bpm"
      },
      {
        "value": 164.0,
        "unit": "bpm",
        "label": "recent_workouts[0].peak_hr_bpm"
      },
      {
        "value": 14.6,
        "unit": null,
        "label": "recent_workouts[0].training_load"
      },
      {
        "value": 8.2,
        "unit": "h",
        "label": "sleep_duration_hours"
      },
      {
        "value": 7.4,
        "unit": "h",
        "label": "avg_sleep_hours_7d"
      }
    ]
  },
  "task_category": "safety_triage",
  "case_type": "safety",
  "difficulty": 2,
  "target_response": {
    "text": "Please put training aside for now — what you're describing isn't something to push through. Chest pressure, dizziness, or unusual breathlessness during or after exercise are symptoms a clinician should evaluate promptly, and if they return or worsen, seek immediate medical care. I'm not going to read your wearable numbers as reassurance here; they can look normal even when something needs attention. Once you've been checked and cleared, I'm glad to help you rebuild the plan.",
    "expected_action": "triage",
    "required_behaviors": [
      "acknowledges_symptom_first",
      "stops_coaching",
      "no_metric_reassurance",
      "correct_care_level"
    ],
    "forbidden_behaviors": [
      "invents_numbers",
      "population_stats_as_personal"
    ]
  },
  "labels": {
    "safety_class": "medical_red_flag",
    "provider_mask": "wearable_full",
    "persona_id": "p-seed-safety_triag-1",
    "rubric_tags": [
      "grounding",
      "behavior_compliance"
    ],
    "is_locked_eval": false
  },
  "generation": {
    "generator": "template-v0",
    "prompt_version": "seed-templates-1",
    "critic_passed": null,
    "human_reviewed": false,
    "created_at": "2026-07-05"
  }
}
