{
 "example_id": "agen-v1-000219",
 "schema_version": "sf-train-1",
 "context": {
  "schema_version": "sf-context-1",
  "request": {
   "user_question": "I'm travelling for work all next week, hotel gyms only and weird hours. how should I rework my training plan so I don't lose the thread?",
   "asked_at_local": "2026-07-05T07:30:00+02:00",
   "weekday": "Sunday",
   "units": "metric"
  },
  "task": {
   "category": "plan_adjustment"
  },
  "user_profile": {
   "age_band": "30-34",
   "biological_sex": "female"
  },
  "today": {
   "date_local": "2026-07-05",
   "recovery_score": null,
   "recovery_confidence": null,
   "readiness_state": null,
   "hrv_ms": null,
   "resting_heart_rate_bpm": null,
   "sleep": {
    "duration_minutes": 423,
    "source": "manual",
    "confidence": "medium"
   },
   "activity": {
    "activity_strain": null
   }
  },
  "baselines": {
   "baseline_30d": null,
   "ranges": {}
  },
  "trends": {
   "window_7d": null
  },
  "recent_workouts": [],
  "safety_flags": [],
  "data_quality": {
   "missing_fields": [
    "recovery_score",
    "hrv_ms",
    "resting_heart_rate_bpm",
    "respiratory_rate_bpm",
    "activity_strain",
    "baseline_30d",
    "trends.window_7d",
    "sleep_stages_minutes",
    "steps"
   ],
   "overall": "low"
  },
  "provenance": {
   "data_provider": "manual",
   "device_type": "manual",
   "source_confidence": {
    "sleep": "medium"
   },
   "strain_scale": null,
   "hrv_method": null
  },
  "allowed_numbers": [
   {
    "value": 423.0,
    "unit": "min",
    "label": "today.sleep.duration_minutes"
   },
   {
    "value": 7.0,
    "unit": "h",
    "label": "sleep_duration_hours"
   }
  ]
 },
 "task_category": "plan_adjustment",
 "case_type": "edge",
 "difficulty": 2,
 "target_response": {
  "text": "Shrink the plan to two anchors and let everything else flex. Anchor one: two or three short strength sessions using whatever the hotel gym has, dumbbells or bodyweight, hitting your main movement patterns at moderate effort. Anchor two: keep easy aerobic work as walks or treadmill sessions on the days between, since travel fatigue punishes high intensity more than volume. Protect sleep hardest of all; you logged 423 minutes last night, about 7 hours, which is a decent base to defend against time-zone chaos, so fix a wake time and keep it. One honest caveat: you're logging manually, so I have no recovery, heart rate, or baseline data to tune this with, and how you feel each morning has to be the intensity dial. Log your sleep and sessions through the week and we can recalibrate the plan when you're back.",
  "expected_action": "answer_with_caveat",
  "must_mention": [
   "sleep 7 h logged",
   "manual logging means no recovery or heart data",
   "concrete travel plan structure"
  ],
  "must_not_mention": [
   "recovery score",
   "HRV values",
   "resting heart rate values"
  ],
  "required_behaviors": [
   "gives_concrete_plan_adjustment",
   "acknowledges_missing_recovery_data",
   "uses_perceived_effort_as_dial"
  ],
  "forbidden_behaviors": [
   "invents_numbers",
   "population_stats_as_personal",
   "cites_wearable_metrics"
  ]
 },
 "labels": {
  "safety_class": "none",
  "provider_mask": "manual_only",
  "persona_id": "p-agen-301-plan_adjus-15",
  "rubric_tags": [
   "grounding",
   "behavior_compliance"
  ],
  "is_locked_eval": false
 },
 "generation": {
  "generator": "agent-fable-5-agent",
  "prompt_version": "agen-2",
  "critic_passed": null,
  "human_reviewed": false,
  "created_at": "2026-07-06"
 }
}
