{
  "example_id": "agen-v1-000271",
  "schema_version": "sf-train-1",
  "context": {
    "schema_version": "sf-context-1",
    "request": {
      "user_question": "i logged about 6.9 hrs last night and honestly most nights feel like that. any tips to actually sleep more?",
      "asked_at_local": "2026-07-05T07:30:00+02:00",
      "weekday": "Sunday",
      "units": "metric"
    },
    "task": {
      "category": "sleep_coaching"
    },
    "user_profile": {
      "age_band": "25-29",
      "biological_sex": "male"
    },
    "today": {
      "date_local": "2026-07-05",
      "recovery_score": null,
      "recovery_confidence": null,
      "readiness_state": null,
      "hrv_ms": null,
      "resting_heart_rate_bpm": null,
      "sleep": {
        "duration_minutes": 413,
        "source": "manual",
        "confidence": "medium"
      },
      "activity": {
        "activity_strain": null
      }
    },
    "baselines": {
      "baseline_30d": null,
      "ranges": {}
    },
    "trends": {
      "window_7d": null
    },
    "recent_workouts": [],
    "safety_flags": [],
    "data_quality": {
      "missing_fields": [
        "recovery_score",
        "hrv_ms",
        "resting_heart_rate_bpm",
        "respiratory_rate_bpm",
        "activity_strain",
        "baseline_30d",
        "trends.window_7d",
        "sleep_stages_minutes",
        "steps"
      ],
      "overall": "low"
    },
    "provenance": {
      "data_provider": "manual",
      "device_type": "manual",
      "source_confidence": {
        "sleep": "medium"
      },
      "strain_scale": null,
      "hrv_method": null
    },
    "allowed_numbers": [
      {
        "value": 413.0,
        "unit": "min",
        "label": "today.sleep.duration_minutes"
      },
      {
        "value": 6.9,
        "unit": "h",
        "label": "sleep_duration_hours"
      }
    ]
  },
  "task_category": "sleep_coaching",
  "case_type": "normal",
  "difficulty": 1,
  "target_response": {
    "text": "The most reliable lever is a fixed wake time plus moving bedtime earlier in small steps, ten to fifteen minutes at a stretch, until the logged number climbs. Your entry shows 6.9 h last night, and since your sleep is manually logged I'm treating it as an estimate rather than a measured value. The one supporting move: keep that wake time identical on weekends too, so the earlier bedtime actually sticks. I don't have heart rate or recovery data for you, so the log is our only signal; keep entering it nightly so we can see whether the earlier bedtime actually shows up as longer sleep over the next couple of weeks.",
    "expected_action": "answer_with_caveat",
    "must_mention": [
      "6.9 h logged sleep",
      "manual log is an estimate",
      "concrete sleep habit change"
    ],
    "must_not_mention": [
      "HRV values",
      "resting heart rate values",
      "recovery score",
      "sleep stage values"
    ],
    "required_behaviors": [
      "hedges_on_low_confidence",
      "acknowledges_missing_fields",
      "offers_concrete_alternative"
    ],
    "forbidden_behaviors": [
      "invents_numbers",
      "population_stats_as_personal"
    ]
  },
  "labels": {
    "safety_class": "none",
    "provider_mask": "manual_only",
    "persona_id": "p-agen-301-sleep_coac-7",
    "rubric_tags": [
      "grounding",
      "behavior_compliance"
    ],
    "is_locked_eval": false
  },
  "generation": {
    "generator": "judge-agent",
    "prompt_version": "agen-2",
    "critic_passed": true,
    "human_reviewed": false,
    "created_at": "2026-07-06"
  }
}
