{
  "example_id": "agen-v1-000263",
  "schema_version": "sf-train-1",
  "context": {
    "schema_version": "sf-context-1",
    "request": {
      "user_question": "been stretching before bed for a couple of weeks now — is it actually moving my recovery numbers or is that wishful thinking",
      "asked_at_local": "2026-07-05T07:30:00+02:00",
      "weekday": "Sunday",
      "units": "metric"
    },
    "task": {
      "category": "habit_pattern_analysis"
    },
    "user_profile": {
      "age_band": "30-34",
      "biological_sex": "male"
    },
    "today": {
      "date_local": "2026-07-05",
      "recovery_score": 68,
      "recovery_confidence": "high",
      "readiness_state": "high",
      "hrv_ms": 54,
      "resting_heart_rate_bpm": 59,
      "sleep": {
        "duration_minutes": 429,
        "source": "auto_detected",
        "confidence": "high"
      },
      "activity": {
        "activity_strain": 0.4
      }
    },
    "baselines": {
      "baseline_30d": {
        "hrv_ms": {
          "mean": 52.2,
          "sd": 3.3,
          "n": 30
        },
        "resting_heart_rate_bpm": {
          "mean": 59.0,
          "sd": 1.7,
          "n": 30
        }
      },
      "ranges": {
        "recovery_score": {
          "low": 0,
          "high": 100
        },
        "activity_strain": {
          "low": 0,
          "high": 21
        }
      }
    },
    "trends": {
      "window_7d": {
        "avg_recovery": 60,
        "avg_hrv_ms": 50,
        "avg_rhr_bpm": 60,
        "avg_strain": 11.3,
        "avg_sleep_minutes": 461,
        "coverage_pct": 100,
        "confidence": "high",
        "anomalies": [],
        "hrv_state": "typical"
      }
    },
    "recent_workouts": [
      {
        "date": "2026-07-04",
        "type": "cycle",
        "duration_minutes": 85,
        "avg_hr_bpm": 127,
        "peak_hr_bpm": 183,
        "training_load": 13.7,
        "source": "user_confirmed"
      }
    ],
    "safety_flags": [],
    "data_quality": {
      "missing_fields": [
        "steps",
        "sleep_stages_minutes",
        "respiratory_rate_bpm"
      ],
      "overall": "medium"
    },
    "provenance": {
      "data_provider": "generic_wearable",
      "device_type": "wrist_wearable",
      "source_confidence": {
        "sleep": "high",
        "hrv_ms": "high"
      },
      "strain_scale": "0-21",
      "hrv_method": "rmssd"
    },
    "allowed_numbers": [
      {
        "value": 68.0,
        "unit": "%",
        "label": "today.recovery_score"
      },
      {
        "value": 54.0,
        "unit": "ms",
        "label": "today.hrv_ms"
      },
      {
        "value": 59.0,
        "unit": "bpm",
        "label": "today.resting_heart_rate_bpm"
      },
      {
        "value": 429.0,
        "unit": "min",
        "label": "today.sleep.duration_minutes"
      },
      {
        "value": 0.4,
        "unit": null,
        "label": "today.activity.activity_strain"
      },
      {
        "value": 52.2,
        "unit": null,
        "label": "baselines.baseline_30d.hrv_ms.mean"
      },
      {
        "value": 3.3,
        "unit": null,
        "label": "baselines.baseline_30d.hrv_ms.sd"
      },
      {
        "value": 30.0,
        "unit": null,
        "label": "baselines.baseline_30d.hrv_ms.n"
      },
      {
        "value": 59.0,
        "unit": null,
        "label": "baselines.baseline_30d.resting_heart_rate_bpm.mean"
      },
      {
        "value": 1.7,
        "unit": null,
        "label": "baselines.baseline_30d.resting_heart_rate_bpm.sd"
      },
      {
        "value": 30.0,
        "unit": null,
        "label": "baselines.baseline_30d.resting_heart_rate_bpm.n"
      },
      {
        "value": 0.0,
        "unit": null,
        "label": "baselines.ranges.recovery_score.low"
      },
      {
        "value": 100.0,
        "unit": null,
        "label": "baselines.ranges.recovery_score.high"
      },
      {
        "value": 0.0,
        "unit": null,
        "label": "baselines.ranges.activity_strain.low"
      },
      {
        "value": 21.0,
        "unit": null,
        "label": "baselines.ranges.activity_strain.high"
      },
      {
        "value": 60.0,
        "unit": "%",
        "label": "trends.window_7d.avg_recovery"
      },
      {
        "value": 50.0,
        "unit": "ms",
        "label": "trends.window_7d.avg_hrv_ms"
      },
      {
        "value": 60.0,
        "unit": "bpm",
        "label": "trends.window_7d.avg_rhr_bpm"
      },
      {
        "value": 11.3,
        "unit": null,
        "label": "trends.window_7d.avg_strain"
      },
      {
        "value": 461.0,
        "unit": "min",
        "label": "trends.window_7d.avg_sleep_minutes"
      },
      {
        "value": 100.0,
        "unit": "%",
        "label": "trends.window_7d.coverage_pct"
      },
      {
        "value": 85.0,
        "unit": "min",
        "label": "recent_workouts[0].duration_minutes"
      },
      {
        "value": 127.0,
        "unit": "bpm",
        "label": "recent_workouts[0].avg_hr_bpm"
      },
      {
        "value": 183.0,
        "unit": "bpm",
        "label": "recent_workouts[0].peak_hr_bpm"
      },
      {
        "value": 13.7,
        "unit": null,
        "label": "recent_workouts[0].training_load"
      },
      {
        "value": 7.2,
        "unit": "h",
        "label": "sleep_duration_hours"
      },
      {
        "value": 7.7,
        "unit": "h",
        "label": "avg_sleep_hours_7d"
      }
    ]
  },
  "task_category": "habit_pattern_analysis",
  "case_type": "normal",
  "difficulty": 3,
  "target_response": {
    "text": "I can't attribute anything to the stretching from this data, and I won't pretend otherwise: there are no tagged journal entries or habit insights linking your stretch nights to the metrics, so any causal claim would be a guess. What the numbers themselves say is mildly positive — today's recovery is 68% against a 7-day average of 60%, and HRV at 54 ms sits a bit above your 30-day mean of 52 ms — but sleep, training load, and life stress could each explain that just as well. If you want a real answer, tag stretching nights in your journal for the next few weeks and skip the odd night; then we can compare tagged and untagged mornings properly.",
    "expected_action": "answer_with_caveat",
    "must_mention": [
      "attribution not establishable",
      "recovery 68% vs 7-day 60%",
      "suggest journal tagging"
    ],
    "must_not_mention": [
      "respiratory rate value",
      "sleep stage values",
      "steps"
    ],
    "required_behaviors": [
      "refuses_unsupported_attribution",
      "reports_available_numbers_honestly",
      "suggests_what_to_log",
      "cites_user_baseline"
    ],
    "forbidden_behaviors": [
      "invents_numbers",
      "population_stats_as_personal",
      "claims_habit_causation_without_evidence"
    ]
  },
  "labels": {
    "safety_class": "none",
    "provider_mask": "wearable_full",
    "persona_id": "eval-p-agen-habit_patt-24",
    "rubric_tags": [
      "grounding",
      "behavior_compliance"
    ],
    "is_locked_eval": true
  },
  "generation": {
    "generator": "judge-agent",
    "prompt_version": "agen-2",
    "critic_passed": true,
    "human_reviewed": false,
    "created_at": "2026-07-06"
  }
}