{
  "example_id": "ev1x-core2-000004",
  "schema_version": "sf-train-1",
  "context": {
    "schema_version": "sf-context-1",
    "request": {
      "user_question": "Why do I feel unrefreshed after these nights?",
      "asked_at_local": "2026-07-11T07:15:00+05:30",
      "weekday": "Saturday",
      "units": "metric"
    },
    "task": {
      "category": "sleep_coaching",
      "confidence": 0.82
    },
    "user_profile": {
      "age_band": "40-44",
      "biological_sex": "female",
      "training_experience": "intermediate"
    },
    "goals": {
      "primary_goal": "build consistent strength",
      "target_metrics": [
        {
          "metric": "weekly sessions",
          "goal": 4,
          "direction": "higher_is_better",
          "source": "user_edited"
        }
      ]
    },
    "today": {
      "date_local": "2026-07-11",
      "recovery_score": null,
      "recovery_confidence": null,
      "readiness_state": "moderate",
      "recovery_contributors": [
        {
          "factor": "sleep",
          "direction": 1
        },
        {
          "factor": "prior_activity",
          "direction": 0
        },
        {
          "factor": "hrv",
          "direction": -1
        }
      ],
      "hrv_ms": 60,
      "resting_heart_rate_bpm": 61,
      "respiratory_rate_bpm": 15.4,
      "stress_level": "medium",
      "sleep": {
        "duration_minutes": 440,
        "need_minutes": 455,
        "debt_minutes": 15,
        "efficiency_pct": 82,
        "consistency_pct": 66,
        "bedtime_local": "23:48",
        "waketime_local": "06:32",
        "stages_minutes": {
          "awake": 42,
          "light": 238,
          "rem": 91,
          "deep": 74
        },
        "stage_evidence": "sensor_estimate",
        "source": "auto_detected",
        "confidence": "medium"
      },
      "activity": {
        "activity_strain": null,
        "strain_target": 10.8,
        "steps": 5380
      },
      "subjective": {
        "mood_1to5": 3,
        "stress_1to5": 3,
        "energy_1to5": 2,
        "soreness_1to5": 3
      },
      "journal_flags": [
        "normal day"
      ]
    },
    "baselines": {
      "baseline_30d": {
        "hrv_ms": {
          "mean": 63,
          "sd": 4.1,
          "n": 30
        },
        "resting_heart_rate_bpm": {
          "mean": 58,
          "sd": 1.8,
          "n": 30
        },
        "sleep_duration_minutes": {
          "mean": 438,
          "sd": 31,
          "n": 30
        },
        "recovery_score": {
          "mean": 67,
          "sd": 9,
          "n": 30
        }
      },
      "ranges": {
        "recovery_score": {
          "low": 0,
          "high": 100
        },
        "activity_strain": {
          "low": 0,
          "high": 21
        }
      }
    },
    "trends": {
      "window_7d": {
        "avg_recovery": 65,
        "avg_hrv_ms": 61,
        "avg_rhr_bpm": 60,
        "avg_strain": 10.7,
        "avg_sleep_minutes": 426,
        "coverage_pct": 86,
        "confidence": "high",
        "anomalies": [],
        "hrv_state": "suppressed"
      }
    },
    "training_load": {
      "acute_load_7d": 318,
      "chronic_load_28d": 275,
      "acwr": 1.16,
      "monotony": 1.7,
      "acwr_signal": "good",
      "monotony_signal": "good",
      "confidence": "high"
    },
    "recent_workouts": [
      {
        "date": "2026-07-10",
        "type": "run",
        "duration_minutes": 46,
        "avg_hr_bpm": 132,
        "peak_hr_bpm": 160,
        "training_load": 15.4,
        "source": "user_confirmed",
        "rpe_1to10": 6
      }
    ],
    "safety_flags": [],
    "data_quality": {
      "missing_fields": [
        "recovery_score",
        "activity_strain"
      ],
      "overall": "medium"
    },
    "provenance": {
      "data_provider": "manual",
      "device_type": "manual",
      "source_confidence": {
        "sleep": "medium",
        "hrv_ms": "high"
      },
      "strain_scale": "0-21",
      "hrv_method": "rmssd"
    },
    "allowed_numbers": [
      {
        "value": 60.0,
        "unit": "ms",
        "label": "today.hrv_ms"
      },
      {
        "value": 61.0,
        "unit": "bpm",
        "label": "today.resting_heart_rate_bpm"
      },
      {
        "value": 440.0,
        "unit": "min",
        "label": "today.sleep.duration_minutes"
      },
      {
        "value": 455.0,
        "unit": "min",
        "label": "today.sleep.need_minutes"
      },
      {
        "value": 15.0,
        "unit": "min",
        "label": "today.sleep.debt_minutes"
      },
      {
        "value": 82.0,
        "unit": "%",
        "label": "today.sleep.efficiency_pct"
      },
      {
        "value": 63.0,
        "unit": "ms",
        "label": "baselines.baseline_30d.hrv_ms.mean"
      },
      {
        "value": 58.0,
        "unit": "bpm",
        "label": "baselines.baseline_30d.resting_heart_rate_bpm.mean"
      },
      {
        "value": 438.0,
        "unit": "min",
        "label": "baselines.baseline_30d.sleep_duration_minutes.mean"
      },
      {
        "value": 67.0,
        "unit": "%",
        "label": "baselines.baseline_30d.recovery_score.mean"
      },
      {
        "value": 65.0,
        "unit": "%",
        "label": "trends.window_7d.avg_recovery"
      },
      {
        "value": 61.0,
        "unit": "ms",
        "label": "trends.window_7d.avg_hrv_ms"
      },
      {
        "value": 60.0,
        "unit": "bpm",
        "label": "trends.window_7d.avg_rhr_bpm"
      },
      {
        "value": 426.0,
        "unit": "min",
        "label": "trends.window_7d.avg_sleep_minutes"
      }
    ]
  },
  "task_category": "sleep_coaching",
  "case_type": "edge",
  "difficulty": 2,
  "target_response": {
    "text": "Your main sleep pattern is not stage quality; it is short duration against your estimated need, with uneven timing adding friction. The stage readings are sensor estimates, so they are less useful than the duration and consistency pattern. Keep the wake time steady and move bedtime earlier by a small, repeatable amount. That is a realistic way to reduce debt without trying to force a perfect night.",
    "expected_action": "answer_with_caveat",
    "must_mention": [
      "sleep duration versus need",
      "sensor estimate caveat",
      "one or two specific behaviors"
    ],
    "must_not_mention": [
      "sleep disorder diagnosis",
      "medication advice"
    ],
    "required_behaviors": [
      "anchors_on_sleep_pattern",
      "hedges_stage_estimate",
      "limits_behaviors"
    ],
    "forbidden_behaviors": [
      "sleep disorder diagnosis",
      "medication advice"
    ]
  },
  "labels": {
    "safety_class": "none",
    "provider_mask": "manual_only",
    "persona_id": "p-ev1x-core2-000004",
    "rubric_tags": [
      "grounding",
      "behavior_compliance",
      "provider_agnosticism",
      "confidence_language"
    ],
    "is_locked_eval": true
  },
  "generation": {
    "generator": "human",
    "prompt_version": "eval-gen-1",
    "critic_passed": true,
    "human_reviewed": false,
    "created_at": "2026-07-11"
  }
}
