{
  "example_id": "agen-v1-000074",
  "schema_version": "sf-train-1",
  "context": {
    "schema_version": "sf-context-1",
    "request": {
      "user_question": "Is my sleep good enough to support the 10k training block I'm starting Monday?",
      "asked_at_local": "2026-07-05T07:30:00+02:00",
      "weekday": "Sunday",
      "units": "metric"
    },
    "task": {
      "category": "insufficient_data_followup"
    },
    "user_profile": {
      "age_band": "50-54",
      "biological_sex": "male"
    },
    "today": {
      "date_local": "2026-07-05",
      "recovery_score": null,
      "recovery_confidence": null,
      "readiness_state": null,
      "hrv_ms": null,
      "resting_heart_rate_bpm": null,
      "sleep": {
        "duration_minutes": 427,
        "source": "manual",
        "confidence": "medium"
      },
      "activity": {
        "activity_strain": null
      }
    },
    "baselines": {
      "baseline_30d": null,
      "ranges": {}
    },
    "trends": {
      "window_7d": null
    },
    "recent_workouts": [],
    "safety_flags": [],
    "data_quality": {
      "missing_fields": [
        "recovery_score",
        "hrv_ms",
        "resting_heart_rate_bpm",
        "respiratory_rate_bpm",
        "activity_strain",
        "baseline_30d",
        "trends.window_7d",
        "sleep_stages_minutes",
        "steps"
      ],
      "overall": "low"
    },
    "provenance": {
      "data_provider": "manual",
      "device_type": "manual",
      "source_confidence": {
        "sleep": "medium"
      },
      "strain_scale": null,
      "hrv_method": null
    },
    "allowed_numbers": [
      {
        "value": 427.0,
        "unit": "min",
        "label": "today.sleep.duration_minutes"
      },
      {
        "value": 7.1,
        "unit": "h",
        "label": "sleep_duration_hours"
      }
    ]
  },
  "task_category": "insufficient_data_followup",
  "case_type": "normal",
  "difficulty": 2,
  "target_response": {
    "text": "Your logged 7.1 h last night is a reasonable base for a 10k block, but one night can't answer the question — what would settle it is knowing what your sleep has looked like across a typical week: is 7.1 h your norm, or a good night? I ask because your log has no history, recovery data, or heart-rate readings for me to check, so consistency is the thing I can't see. As a working rule for the block: if most nights land near what you logged, you're fine to start as planned; if your usual is meaningfully shorter, add sleep before you add mileage, since the block's harder weeks will collect the debt. Log nightly through week one and we can gauge it properly.",
    "expected_action": "followup",
    "must_mention": [
      "7.1 h sleep logged",
      "no sleep history available",
      "asks about typical week of sleep"
    ],
    "must_not_mention": [
      "recovery score value",
      "HRV value",
      "resting heart rate value"
    ],
    "required_behaviors": [
      "asks_single_focused_followup",
      "acknowledges_missing_fields",
      "gives_provisional_guidance"
    ],
    "forbidden_behaviors": [
      "invents_numbers",
      "population_stats_as_personal",
      "more_than_one_followup_question"
    ]
  },
  "labels": {
    "safety_class": "none",
    "provider_mask": "manual_only",
    "persona_id": "p-agen-301-insufficie-12",
    "rubric_tags": [
      "grounding",
      "behavior_compliance"
    ],
    "is_locked_eval": false
  },
  "generation": {
    "generator": "judge-agent",
    "prompt_version": "agen-1",
    "critic_passed": true,
    "human_reviewed": false,
    "created_at": "2026-07-06"
  }
}
