{
  "example_id": "agv4-000072",
  "schema_version": "sf-train-1",
  "context": {
    "schema_version": "sf-context-1",
    "request": {
      "user_question": "My app gave me 86% sleep performance. What does that number even mean?",
      "asked_at_local": "2026-07-08T08:50:00+02:00",
      "weekday": "Wednesday",
      "units": "metric"
    },
    "task": {
      "category": "explain_metric"
    },
    "user_profile": {
      "age_band": "20-24",
      "biological_sex": "female",
      "training_experience": "beginner"
    },
    "today": {
      "date_local": "2026-07-08",
      "recovery_score": 70,
      "recovery_confidence": "high",
      "readiness_state": "moderate",
      "hrv_ms": 62,
      "resting_heart_rate_bpm": 56,
      "sleep": {
        "duration_minutes": 402,
        "need_minutes": 465,
        "performance_pct": 86,
        "source": "sensor_estimate",
        "confidence": "medium"
      },
      "activity": {
        "activity_strain": 0.6
      }
    },
    "baselines": {
      "baseline_30d": {
        "hrv_ms": {
          "mean": 61.9,
          "sd": 4.3,
          "n": 30
        },
        "resting_heart_rate_bpm": {
          "mean": 56.3,
          "sd": 1.3,
          "n": 30
        },
        "sleep_duration_minutes": {
          "mean": 414.0,
          "sd": 40.0,
          "n": 30
        }
      },
      "ranges": {
        "recovery_score": {
          "low": 0,
          "high": 100
        },
        "activity_strain": {
          "low": 0,
          "high": 21
        }
      }
    },
    "trends": {
      "window_7d": {
        "avg_recovery": 69,
        "avg_hrv_ms": 62,
        "avg_rhr_bpm": 56,
        "avg_strain": 10.4,
        "avg_sleep_minutes": 425,
        "coverage_pct": 100,
        "confidence": "high",
        "anomalies": [],
        "hrv_state": "typical"
      }
    },
    "recent_workouts": [
      {
        "date": "2026-07-07",
        "type": "run",
        "duration_minutes": 36,
        "avg_hr_bpm": 150,
        "peak_hr_bpm": 168,
        "training_load": 9.2,
        "source": "user_confirmed"
      }
    ],
    "safety_flags": [],
    "data_quality": {
      "missing_fields": [
        "steps",
        "sleep_stages_minutes",
        "respiratory_rate_bpm"
      ],
      "overall": "medium"
    },
    "provenance": {
      "data_provider": "generic_wearable",
      "device_type": "wrist_wearable",
      "source_confidence": {
        "sleep": "medium",
        "hrv_ms": "high"
      },
      "strain_scale": "0-21",
      "hrv_method": "rmssd"
    },
    "allowed_numbers": [
      {
        "value": 70.0,
        "unit": "%",
        "label": "today.recovery_score"
      },
      {
        "value": 62.0,
        "unit": "ms",
        "label": "today.hrv_ms"
      },
      {
        "value": 56.0,
        "unit": "bpm",
        "label": "today.resting_heart_rate_bpm"
      },
      {
        "value": 402.0,
        "unit": "min",
        "label": "today.sleep.duration_minutes"
      },
      {
        "value": 465.0,
        "unit": "min",
        "label": "today.sleep.need_minutes"
      },
      {
        "value": 86.0,
        "unit": "%",
        "label": "today.sleep.performance_pct"
      },
      {
        "value": 0.6,
        "unit": null,
        "label": "today.activity.activity_strain"
      },
      {
        "value": 61.9,
        "unit": null,
        "label": "baselines.baseline_30d.hrv_ms.mean"
      },
      {
        "value": 4.3,
        "unit": null,
        "label": "baselines.baseline_30d.hrv_ms.sd"
      },
      {
        "value": 30.0,
        "unit": null,
        "label": "baselines.baseline_30d.hrv_ms.n"
      },
      {
        "value": 56.3,
        "unit": null,
        "label": "baselines.baseline_30d.resting_heart_rate_bpm.mean"
      },
      {
        "value": 1.3,
        "unit": null,
        "label": "baselines.baseline_30d.resting_heart_rate_bpm.sd"
      },
      {
        "value": 30.0,
        "unit": null,
        "label": "baselines.baseline_30d.resting_heart_rate_bpm.n"
      },
      {
        "value": 414.0,
        "unit": null,
        "label": "baselines.baseline_30d.sleep_duration_minutes.mean"
      },
      {
        "value": 40.0,
        "unit": null,
        "label": "baselines.baseline_30d.sleep_duration_minutes.sd"
      },
      {
        "value": 30.0,
        "unit": null,
        "label": "baselines.baseline_30d.sleep_duration_minutes.n"
      },
      {
        "value": 0.0,
        "unit": null,
        "label": "baselines.ranges.recovery_score.low"
      },
      {
        "value": 100.0,
        "unit": null,
        "label": "baselines.ranges.recovery_score.high"
      },
      {
        "value": 0.0,
        "unit": null,
        "label": "baselines.ranges.activity_strain.low"
      },
      {
        "value": 21.0,
        "unit": null,
        "label": "baselines.ranges.activity_strain.high"
      },
      {
        "value": 69.0,
        "unit": "%",
        "label": "trends.window_7d.avg_recovery"
      },
      {
        "value": 62.0,
        "unit": "ms",
        "label": "trends.window_7d.avg_hrv_ms"
      },
      {
        "value": 56.0,
        "unit": "bpm",
        "label": "trends.window_7d.avg_rhr_bpm"
      },
      {
        "value": 10.4,
        "unit": null,
        "label": "trends.window_7d.avg_strain"
      },
      {
        "value": 425.0,
        "unit": "min",
        "label": "trends.window_7d.avg_sleep_minutes"
      },
      {
        "value": 100.0,
        "unit": "%",
        "label": "trends.window_7d.coverage_pct"
      },
      {
        "value": 36.0,
        "unit": "min",
        "label": "recent_workouts[0].duration_minutes"
      },
      {
        "value": 150.0,
        "unit": "bpm",
        "label": "recent_workouts[0].avg_hr_bpm"
      },
      {
        "value": 168.0,
        "unit": "bpm",
        "label": "recent_workouts[0].peak_hr_bpm"
      },
      {
        "value": 9.2,
        "unit": null,
        "label": "recent_workouts[0].training_load"
      },
      {
        "value": 6.7,
        "unit": "h",
        "label": "derived.sleep_duration_hours"
      },
      {
        "value": 7.8,
        "unit": "h",
        "label": "derived.sleep_need_hours"
      },
      {
        "value": 7.1,
        "unit": "h",
        "label": "derived.avg_sleep_hours_7d"
      }
    ]
  },
  "task_category": "explain_metric",
  "case_type": "normal",
  "difficulty": 2,
  "target_response": {
    "text": "Sleep performance is just a ratio: the sleep you actually got as a share of what your body needed, so it's a duration score, not a quality score. Your 86% comes from sleeping 6.7 hours, well short of your sleep need of 7.8 hours — nothing more mysterious than that. One caveat: your tracker grades last night's duration at medium confidence, so read the exact minutes loosely even though the overall picture is clear. And it is a picture, not a blip — your 7-day average of 7.1 hours tells the same story of running a little lean. If you want the number to move, it responds to exactly one thing: more time in bed, added at the front of the night.",
    "expected_action": "answer_with_caveat",
    "must_mention": [
      "performance defined as duration vs need",
      "medium confidence hedged",
      "7-day average named"
    ],
    "must_not_mention": [
      "invented comparison window",
      "false direction claim"
    ],
    "required_behaviors": [
      "names_confidence_grade",
      "states_true_comparison_direction",
      "names_comparison_window_explicitly"
    ],
    "forbidden_behaviors": [
      "invents_numbers",
      "asserts_false_relation",
      "invents_comparison_window"
    ]
  },
  "labels": {
    "safety_class": "none",
    "provider_mask": "wearable_full",
    "persona_id": "p-agv4-72-sleep-performance",
    "rubric_tags": [
      "grounding",
      "relational_correctness",
      "behavior_compliance"
    ],
    "is_locked_eval": false
  },
  "generation": {
    "generator": "agent-fable-5-agent",
    "prompt_version": "agv4-relational-1",
    "critic_passed": true,
    "human_reviewed": false,
    "created_at": "2026-07-09"
  }
}
