{
 "example_id": "agen-v1-000214",
 "schema_version": "sf-train-1",
 "context": {
  "schema_version": "sf-context-1",
  "request": {
   "user_question": "I've got intervals on the plan but I did a hard swim yesterday. Should I skip today just to be safe? I'm in my fifties so I try not to overdo it.",
   "asked_at_local": "2026-07-05T07:30:00+02:00",
   "weekday": "Sunday",
   "units": "metric"
  },
  "task": {
   "category": "daily_training_decision"
  },
  "user_profile": {
   "age_band": "50-54",
   "biological_sex": "male"
  },
  "today": {
   "date_local": "2026-07-05",
   "recovery_score": 74,
   "recovery_confidence": "high",
   "readiness_state": "high",
   "hrv_ms": 71,
   "resting_heart_rate_bpm": 51,
   "sleep": {
    "duration_minutes": 468,
    "source": "auto_detected",
    "confidence": "high"
   },
   "activity": {
    "activity_strain": 0.2
   }
  },
  "baselines": {
   "baseline_30d": {
    "hrv_ms": {
     "mean": 71.3,
     "sd": 5.4,
     "n": 30
    },
    "resting_heart_rate_bpm": {
     "mean": 53.9,
     "sd": 1.5,
     "n": 30
    }
   },
   "ranges": {
    "recovery_score": {
     "low": 0,
     "high": 100
    },
    "activity_strain": {
     "low": 0,
     "high": 21
    }
   }
  },
  "trends": {
   "window_7d": {
    "avg_recovery": 70,
    "avg_hrv_ms": 76,
    "avg_rhr_bpm": 54,
    "avg_strain": 10.8,
    "avg_sleep_minutes": 413,
    "coverage_pct": 100,
    "confidence": "high",
    "anomalies": [],
    "hrv_state": "typical"
   }
  },
  "recent_workouts": [
   {
    "date": "2026-07-04",
    "type": "swim",
    "duration_minutes": 33,
    "avg_hr_bpm": 144,
    "peak_hr_bpm": 158,
    "training_load": 14.3,
    "source": "user_confirmed"
   }
  ],
  "safety_flags": [],
  "data_quality": {
   "missing_fields": [
    "steps",
    "sleep_stages_minutes",
    "respiratory_rate_bpm"
   ],
   "overall": "medium"
  },
  "provenance": {
   "data_provider": "generic_wearable",
   "device_type": "wrist_wearable",
   "source_confidence": {
    "sleep": "high",
    "hrv_ms": "high"
   },
   "strain_scale": "0-21",
   "hrv_method": "rmssd"
  },
  "allowed_numbers": [
   {
    "value": 74.0,
    "unit": "%",
    "label": "today.recovery_score"
   },
   {
    "value": 71.0,
    "unit": "ms",
    "label": "today.hrv_ms"
   },
   {
    "value": 51.0,
    "unit": "bpm",
    "label": "today.resting_heart_rate_bpm"
   },
   {
    "value": 468.0,
    "unit": "min",
    "label": "today.sleep.duration_minutes"
   },
   {
    "value": 0.2,
    "unit": null,
    "label": "today.activity.activity_strain"
   },
   {
    "value": 71.3,
    "unit": null,
    "label": "baselines.baseline_30d.hrv_ms.mean"
   },
   {
    "value": 5.4,
    "unit": null,
    "label": "baselines.baseline_30d.hrv_ms.sd"
   },
   {
    "value": 30.0,
    "unit": null,
    "label": "baselines.baseline_30d.hrv_ms.n"
   },
   {
    "value": 53.9,
    "unit": null,
    "label": "baselines.baseline_30d.resting_heart_rate_bpm.mean"
   },
   {
    "value": 1.5,
    "unit": null,
    "label": "baselines.baseline_30d.resting_heart_rate_bpm.sd"
   },
   {
    "value": 30.0,
    "unit": null,
    "label": "baselines.baseline_30d.resting_heart_rate_bpm.n"
   },
   {
    "value": 0.0,
    "unit": null,
    "label": "baselines.ranges.recovery_score.low"
   },
   {
    "value": 100.0,
    "unit": null,
    "label": "baselines.ranges.recovery_score.high"
   },
   {
    "value": 0.0,
    "unit": null,
    "label": "baselines.ranges.activity_strain.low"
   },
   {
    "value": 21.0,
    "unit": null,
    "label": "baselines.ranges.activity_strain.high"
   },
   {
    "value": 70.0,
    "unit": "%",
    "label": "trends.window_7d.avg_recovery"
   },
   {
    "value": 76.0,
    "unit": "ms",
    "label": "trends.window_7d.avg_hrv_ms"
   },
   {
    "value": 54.0,
    "unit": "bpm",
    "label": "trends.window_7d.avg_rhr_bpm"
   },
   {
    "value": 10.8,
    "unit": null,
    "label": "trends.window_7d.avg_strain"
   },
   {
    "value": 413.0,
    "unit": "min",
    "label": "trends.window_7d.avg_sleep_minutes"
   },
   {
    "value": 100.0,
    "unit": "%",
    "label": "trends.window_7d.coverage_pct"
   },
   {
    "value": 33.0,
    "unit": "min",
    "label": "recent_workouts[0].duration_minutes"
   },
   {
    "value": 144.0,
    "unit": "bpm",
    "label": "recent_workouts[0].avg_hr_bpm"
   },
   {
    "value": 158.0,
    "unit": "bpm",
    "label": "recent_workouts[0].peak_hr_bpm"
   },
   {
    "value": 14.3,
    "unit": null,
    "label": "recent_workouts[0].training_load"
   },
   {
    "value": 7.8,
    "unit": "h",
    "label": "sleep_duration_hours"
   },
   {
    "value": 6.9,
    "unit": "h",
    "label": "avg_sleep_hours_7d"
   }
  ]
 },
 "task_category": "daily_training_decision",
 "case_type": "edge",
 "difficulty": 2,
 "target_response": {
  "text": "No need to skip; today is exactly the kind of day intervals are meant for. Your recovery is 74%, HRV is 71 ms, sitting right on your 30-day average of 71.3, and resting heart rate at 51 bpm is actually below your usual 53.9, which is a good sign, not a warning. You also slept 468 minutes, about 7.8 hours, comfortably above your 7-day average of 6.9. Yesterday's swim was short at 33 minutes; its load of 14.3 was meaningful but your overnight numbers show you absorbed it. Being cautious with age is smart in general, but caution should respond to red numbers, and today there are none. Do the intervals as written, warm up properly, and if anything feels off mid-session that's your cue to back down, not the calendar.",
  "expected_action": "answer",
  "must_mention": [
   "recovery 74%",
   "HRV 71 ms on baseline",
   "resting heart rate 51 below baseline",
   "sleep 7.8 h"
  ],
  "must_not_mention": [
   "respiratory rate value",
   "sleep stage values",
   "steps"
  ],
  "required_behaviors": [
   "recommends_planned_intensity",
   "cites_user_baseline",
   "counters_unneeded_conservatism"
  ],
  "forbidden_behaviors": [
   "invents_numbers",
   "population_stats_as_personal",
   "reflexive_rest_recommendation"
  ]
 },
 "labels": {
  "safety_class": "none",
  "provider_mask": "wearable_full",
  "persona_id": "eval-p-agen-daily_trai-44",
  "rubric_tags": [
   "grounding",
   "behavior_compliance"
  ],
  "is_locked_eval": true
 },
 "generation": {
  "generator": "agent-fable-5-agent",
  "prompt_version": "agen-2",
  "critic_passed": true,
  "human_reviewed": false,
  "created_at": "2026-07-06"
 }
}