{
  "example_id": "agen-v1-000285",
  "schema_version": "sf-train-1",
  "context": {
    "schema_version": "sf-context-1",
    "request": {
      "user_question": "long ride planned today but only slept 6h. go or no?",
      "asked_at_local": "2026-07-05T07:30:00+02:00",
      "weekday": "Sunday",
      "units": "metric"
    },
    "task": {
      "category": "daily_training_decision"
    },
    "user_profile": {
      "age_band": "60-64",
      "biological_sex": "male"
    },
    "today": {
      "date_local": "2026-07-05",
      "recovery_score": null,
      "recovery_confidence": null,
      "readiness_state": null,
      "hrv_ms": null,
      "resting_heart_rate_bpm": null,
      "sleep": {
        "duration_minutes": 359,
        "source": "manual",
        "confidence": "medium"
      },
      "activity": {
        "activity_strain": null
      }
    },
    "baselines": {
      "baseline_30d": null,
      "ranges": {}
    },
    "trends": {
      "window_7d": null
    },
    "recent_workouts": [],
    "safety_flags": [],
    "data_quality": {
      "missing_fields": [
        "recovery_score",
        "hrv_ms",
        "resting_heart_rate_bpm",
        "respiratory_rate_bpm",
        "activity_strain",
        "baseline_30d",
        "trends.window_7d",
        "sleep_stages_minutes",
        "steps"
      ],
      "overall": "low"
    },
    "provenance": {
      "data_provider": "manual",
      "device_type": "manual",
      "source_confidence": {
        "sleep": "medium"
      },
      "strain_scale": null,
      "hrv_method": null
    },
    "allowed_numbers": [
      {
        "value": 359.0,
        "unit": "min",
        "label": "today.sleep.duration_minutes"
      },
      {
        "value": 6.0,
        "unit": "h",
        "label": "sleep_duration_hours"
      }
    ]
  },
  "task_category": "daily_training_decision",
  "case_type": "edge",
  "difficulty": 2,
  "target_response": {
    "text": "Go, but let the first half hour make the final call. All I can see on my side is your manual log of 359 minutes, right around 6 h, with no heart rate, recovery, or baseline data to add nuance, so your own body is the better instrument today. A single shortish night usually doesn't wreck a long aerobic ride; it mostly dulls the top end. Start at an easy conversational effort, and if you feel progressively better as you warm up, complete the ride as planned. If you're still heavy-legged and foggy after thirty minutes, cut the route down rather than grinding through. Either way, prioritize an earlier night tonight.",
    "expected_action": "answer_with_caveat",
    "must_mention": [
      "6 h manual sleep only signal",
      "decide after warm-up",
      "shorten if still flat"
    ],
    "must_not_mention": [
      "HRV values",
      "resting heart rate values",
      "recovery score"
    ],
    "required_behaviors": [
      "acknowledges_missing_fields",
      "gives_explicit_recommendation_level",
      "offers_concrete_alternative"
    ],
    "forbidden_behaviors": [
      "invents_numbers",
      "population_stats_as_personal",
      "reflexive_rest_recommendation"
    ]
  },
  "labels": {
    "safety_class": "none",
    "provider_mask": "manual_only",
    "persona_id": "p-agen-301-daily_trai-20",
    "rubric_tags": [
      "grounding",
      "behavior_compliance"
    ],
    "is_locked_eval": false
  },
  "generation": {
    "generator": "judge-agent",
    "prompt_version": "agen-2",
    "critic_passed": true,
    "human_reviewed": false,
    "created_at": "2026-07-06"
  }
}
